id,subreddit,matched_query,author,title,selftext,text,score,upvote_ratio,num_comments,created_at,permalink,over_18,link_flair_text,source
1tpdixk,cars,Ferrari Luce,goonmaster678941,The new Ferrari Luce is a disgrace to the brand...,[removed],The new Ferrari Luce is a disgrace to the brand.... [removed],1,1.0,1,2026-05-27 18:05:07+00:00,/r/cars/comments/1tpdixk/the_new_ferrari_luce_is_a_disgrace_to_the_brand/,False,,reddit
1tpbwjs,cars,Ferrari Luce,Effective_Bug6021,Can the Ferrari Luce be able to live up to the legacy of it's petrol counterparts?,[removed],Can the Ferrari Luce be able to live up to the legacy of it's petrol counterparts?. [removed],0,0.33000001311302185,1,2026-05-27 17:10:07+00:00,/r/cars/comments/1tpbwjs/can_the_ferrari_luce_be_able_to_live_up_to_the/,False,,reddit
1tp4hyj,cars,Ferrari Luce,ladessavictor,Was the Ferrari Luce made ugly on purpose because it is electric?,[removed],Was the Ferrari Luce made ugly on purpose because it is electric?. [removed],1,1.0,1,2026-05-27 12:45:01+00:00,/r/cars/comments/1tp4hyj/was_the_ferrari_luce_made_ugly_on_purpose_because/,False,,reddit
1toza8e,cars,Ferrari Luce,Slice5755,"Very informative video on the behind the scenes of the Ferrari Luce launch. Tim goes into the $600,000 fine in the event that information is leaked...","I know Tim from Shmee150 is not everyone's cup of tea but he goes into a lot of detail on the Ferrari Luce launch. He speaks about huge fines ($600,000) as well as forcing the journalists to do a quick review within half an hour while being watched over by Ferrari personnel like some prison wardens.

https://youtu.be/xahb1U2WI_A","Very informative video on the behind the scenes of the Ferrari Luce launch. Tim goes into the $600,000 fine in the event that information is leaked.... I know Tim from Shmee150 is not everyone's cup of tea but he goes into a lot of detail on the Ferrari Luce launch. He speaks about huge fines ($600,000) as well as forcing the journalists to do a quick review within half an hour while being watched over by Ferrari personnel like some prison wardens.

https://youtu.be/xahb1U2WI_A",645,0.9399999976158142,188,2026-05-27 08:23:41+00:00,/r/cars/comments/1toza8e/very_informative_video_on_the_behind_the_scenes/,False,,reddit
1tovl6c,cars,Ferrari Luce,QuantumQuicksilver,Ferrari Luce unveiled,,Ferrari Luce unveiled.,0,0.12999999523162842,9,2026-05-27 05:05:43+00:00,/r/cars/comments/1tovl6c/ferrari_luce_unveiled/,False,,reddit
1topozs,cars,Ferrari Luce,NovWhiskey,Ferrari Luce is a marketing stunt,"And you're all a bunch of saps. See you in a couple of months, but you can start calling me ""sir"" now. 

Idiots.","Ferrari Luce is a marketing stunt. And you're all a bunch of saps. See you in a couple of months, but you can start calling me ""sir"" now. 

Idiots.",0,0.15000000596046448,8,2026-05-27 00:38:28+00:00,/r/cars/comments/1topozs/ferrari_luce_is_a_marketing_stunt/,False,,reddit
1tonvq5,cars,Ferrari Luce,Pure-Sun512,[Ferrari Luce Launch],[removed],[Ferrari Luce Launch]. [removed],1,1.0,1,2026-05-26 23:23:42+00:00,/r/cars/comments/1tonvq5/ferrari_luce_launch/,False,,reddit
1togqb8,cars,Ferrari Luce,Classic-Affect-9956,Ferrari Rewrites Its Own Rules with the All-Electric Luce,,Ferrari Rewrites Its Own Rules with the All-Electric Luce.,1,1.0,0,2026-05-26 19:03:42+00:00,/r/cars/comments/1togqb8/ferrari_rewrites_its_own_rules_with_the/,False,,reddit
1toel2u,cars,Ferrari Luce,batmmaannn,Why do car brands do this?,"FERRARI LUCE

Whenever a company launches a car and majority of the audience hates the design straightaway, it makes me think why don't the people working on that car ever thought the same way, like why launch a car when it looks ugly, when most of the people are not liking the car I'm pretty sure that the opinion remains the same with the engineers too who built the car. Waiting billion on the RnD just to come up with some trashy design makes no sense.And I'm not talking about BMWs they maybe design thinking what future cars would look like and they're trying to change or modernise,  ur this luce by ferrari ain't the future looking car.","Why do car brands do this?. FERRARI LUCE

Whenever a company launches a car and majority of the audience hates the design straightaway, it makes me think why don't the people working on that car ever thought the same way, like why launch a car when it looks ugly, when most of the people are not liking the car I'm pretty sure that the opinion remains the same with the engineers too who built the car. Waiting billion on the RnD just to come up with some trashy design makes no sense.And I'm not talking about BMWs they maybe design thinking what future cars would look like and they're trying to change or modernise,  ur this luce by ferrari ain't the future looking car.",0,0.33000001311302185,4,2026-05-26 17:52:06+00:00,/r/cars/comments/1toel2u/why_do_car_brands_do_this/,False,,reddit
1todcs0,cars,Ferrari Luce,andix3,Ferrari Stock Falls 6% After Electric Vehicle 'Luce' Debut,,Ferrari Stock Falls 6% After Electric Vehicle 'Luce' Debut.,1,1.0,2,2026-05-26 17:10:49+00:00,/r/cars/comments/1todcs0/ferrari_stock_falls_6_after_electric_vehicle_luce/,False,,reddit
1tocmv4,cars,Ferrari Luce,HistoryFan06,You are all very stupid for hating the Ferrari Luce,[removed],You are all very stupid for hating the Ferrari Luce. [removed],1,1.0,1,2026-05-26 16:46:20+00:00,/r/cars/comments/1tocmv4/you_are_all_very_stupid_for_hating_the_ferrari/,False,,reddit
1to6xv9,cars,Ferrari Luce,W9967,Chris Harris on Ferrari Luce Unveiling: “You had to meet certain criteria to be invited and I am proud to say I didn’t meet them”,"On the latest [emergency podcast episode of The Car Podcast with Chris Harris and Friends,](https://youtu.be/pRwH59HPLgU) Chris said:

\> As a journalist I can tell you, you had to meet certain criteria to be invited to the unveiling and I am proud to say I didn’t meet them. I was telephoned and asked ‘how positive I was about electric cars’ and I said ‘not very’. And the invite was not forthcoming

Personally, I know it’s nothing new from Ferrari, that they are trying to manage their image and the car’s reviews. But it puts things like MKBHD’s video on the design of the car into perspective and frankly, it shows the brands control over his incredibly careful word selection when he was talking about the exterior of the car. 

We are probably going to see more of the similiar tone in reviews of this car untill people can access through other channels and be open about *what they actually think.*","Chris Harris on Ferrari Luce Unveiling: “You had to meet certain criteria to be invited and I am proud to say I didn’t meet them”. On the latest [emergency podcast episode of The Car Podcast with Chris Harris and Friends,](https://youtu.be/pRwH59HPLgU) Chris said:

\> As a journalist I can tell you, you had to meet certain criteria to be invited to the unveiling and I am proud to say I didn’t meet them. I was telephoned and asked ‘how positive I was about electric cars’ and I said ‘not very’. And the invite was not forthcoming

Personally, I know it’s nothing new from Ferrari, that they are trying to manage their image and the car’s reviews. But it puts things like MKBHD’s video on the design of the car into perspective and frankly, it shows the brands control over his incredibly careful word selection when he was talking about the exterior of the car. 

We are probably going to see more of the similiar tone in reviews of this car untill people can access through other channels and be open about *what they actually think.*",2307,0.9700000286102295,557,2026-05-26 13:26:54+00:00,/r/cars/comments/1to6xv9/chris_harris_on_ferrari_luce_unveiling_you_had_to/,False,,reddit
1to1qt3,cars,Ferrari Luce,Hewasright_89,Why dont people like the Ferrari Luce Design?,[removed],Why dont people like the Ferrari Luce Design?. [removed],1,1.0,1,2026-05-26 09:27:35+00:00,/r/cars/comments/1to1qt3/why_dont_people_like_the_ferrari_luce_design/,False,,reddit
1to1qoa,cars,Ferrari Luce,Hewasright_89,Why dont people like the Ferrari Luce Design?,[removed],Why dont people like the Ferrari Luce Design?. [removed],1,1.0,1,2026-05-26 09:27:22+00:00,/r/cars/comments/1to1qoa/why_dont_people_like_the_ferrari_luce_design/,False,,reddit
1tnzstw,cars,Ferrari Luce,Silentkindfromsauna,Ferrari Luce will sell like hot cakes,"Pretty much the title. 

There’s a huge disconnect in what r/cars thinks of a car and what the general population will. Let’s look at some facts:

1: EVs are getting more popular in wealthy countries  
2: current Ferrari model line is pretty much entirely 2-seater sports cars

Whereas the Purosangue has some overlap with the existing audience, the Luce is aimed at an entirely different audience. Those who would want a Ferrari but that don’t want the compromises from a V12 2-seater, combined with the effortless of a EV. 

This will appeal to a brand new audience bringing them to the brand. Fantastic move by Ferrari.","Ferrari Luce will sell like hot cakes. Pretty much the title. 

There’s a huge disconnect in what r/cars thinks of a car and what the general population will. Let’s look at some facts:

1: EVs are getting more popular in wealthy countries  
2: current Ferrari model line is pretty much entirely 2-seater sports cars

Whereas the Purosangue has some overlap with the existing audience, the Luce is aimed at an entirely different audience. Those who would want a Ferrari but that don’t want the compromises from a V12 2-seater, combined with the effortless of a EV. 

This will appeal to a brand new audience bringing them to the brand. Fantastic move by Ferrari.",0,0.2199999988079071,117,2026-05-26 07:37:26+00:00,/r/cars/comments/1tnzstw/ferrari_luce_will_sell_like_hot_cakes/,False,Hot Take,reddit
1tnzbtu,cars,Ferrari Luce,nemandzax,Ferrari Luce Makes Sense,[removed],Ferrari Luce Makes Sense. [removed],0,0.5,1,2026-05-26 07:11:25+00:00,/r/cars/comments/1tnzbtu/ferrari_luce_makes_sense/,False,,reddit
1tnyt9z,cars,Ferrari Luce,Gloobou,One of the better interviews about design of Ferrari Luce,,One of the better interviews about design of Ferrari Luce.,1,1.0,1,2026-05-26 06:43:14+00:00,/r/cars/comments/1tnyt9z/one_of_the_better_interviews_about_design_of/,False,,reddit
1tnq857,cars,Ferrari Luce,MotorSpexx,"Inside the Ferrari Luce | Interior Design, Tech & Cockpit",,"Inside the Ferrari Luce | Interior Design, Tech & Cockpit.",1,1.0,1,2026-05-26 00:01:36+00:00,/r/cars/comments/1tnq857/inside_the_ferrari_luce_interior_design_tech/,False,,reddit
1tnot2g,cars,Ferrari Luce,MotorSpexx,Ferrari Luce | The Aerodynamics of Ferrari’s First EV Explained,,Ferrari Luce | The Aerodynamics of Ferrari’s First EV Explained.,1,1.0,1,2026-05-25 23:01:48+00:00,/r/cars/comments/1tnot2g/ferrari_luce_the_aerodynamics_of_ferraris_first/,False,,reddit
1tnkguy,cars,Ferrari Luce,Anchor_Aways,This Is Ferrari's First EV: The Luce,,This Is Ferrari's First EV: The Luce.,945,0.9200000166893005,1104,2026-05-25 20:12:25+00:00,/r/cars/comments/1tnkguy/this_is_ferraris_first_ev_the_luce/,False,,reddit
1tnkf23,cars,Ferrari Luce,Mental_Medium3988,The Ferrari Luce: officially revealed,,The Ferrari Luce: officially revealed.,1,1.0,1,2026-05-25 20:10:33+00:00,/r/cars/comments/1tnkf23/the_ferrari_luce_officially_revealed/,False,video,reddit
1tj3x23,cars,Ferrari Luce,BoxBoxBox888,The Electric Ferrari Luce Is Still Looking Wacky Days Before Its Reveal,,The Electric Ferrari Luce Is Still Looking Wacky Days Before Its Reveal.,185,0.9399999976158142,57,2026-05-21 00:14:22+00:00,/r/cars/comments/1tj3x23/the_electric_ferrari_luce_is_still_looking_wacky/,False,,reddit
1su0ver,cars,Ferrari Luce,hi_im_bored13,"Ferrari Luce EV Base Price Will Start at Nearly $650,000: Report Claims",,"Ferrari Luce EV Base Price Will Start at Nearly $650,000: Report Claims.",156,0.9200000166893005,106,2026-04-24 00:54:41+00:00,/r/cars/comments/1su0ver/ferrari_luce_ev_base_price_will_start_at_nearly/,False,,reddit
1sn8xtm,cars,Ferrari Luce,strongmanass,Ferrari Luce Interior,"Another video from Ferrari about the Luce interior. [VIDEO LINK](https://youtu.be/DP7vVve0jGc?si=hdGMrsiZH2v86YlF)

They're \*really\* trying to focus on the tactility. What they haven't said anything about is the driving experience.

Maybe it's just how they decided to segment the marketing campaign, but the message I get from the world's proudest performance brand focusing exclusively on the interior of their first ever EV is that they don't feel they have anything innovative or unique to offer to the performance EV driving experience. If we look at other legacy EV messaging:

* Porsche gave the Taycan a 2 speed gearbox because they wanted to maintain high-speed acceleration. They removed the rear seats to make a track variant. They drag raced the Cayenne EV against the 918
* Rolls Royce's first line about the Spectre was a quote from Charles Rolls in 1900 wishing for EVs and how the Spectre finally grants that wish
* BMW gave their upcoming EVs the same name as the company-rescuing gamble from the 1960s and styling cues to match
* Jaguar are desperately trying to convince people that their new EV is a modern XJC
* Mercedes gave the AMG GT EV the exact same sound as their V8
* Audi say the Concept C is inspired by their cars going back to 1936
* Alpine say the A110 EV is still focused on being as light as possible (for an EV)

Everyone is focusing on legacy and brand identity. But Ferrari...""look at our interior designed by the iPhone guy."" They haven't even confirmed the body style. IMO it's very strange messaging from the quintessential supercar maker.

**TL;DR**: new Ferrari Luce interior video [HERE](https://youtu.be/DP7vVve0jGc?si=hdGMrsiZH2v86YlF). Why no focus on how it drives?","Ferrari Luce Interior. Another video from Ferrari about the Luce interior. [VIDEO LINK](https://youtu.be/DP7vVve0jGc?si=hdGMrsiZH2v86YlF)

They're \*really\* trying to focus on the tactility. What they haven't said anything about is the driving experience.

Maybe it's just how they decided to segment the marketing campaign, but the message I get from the world's proudest performance brand focusing exclusively on the interior of their first ever EV is that they don't feel they have anything innovative or unique to offer to the performance EV driving experience. If we look at other legacy EV messaging:

* Porsche gave the Taycan a 2 speed gearbox because they wanted to maintain high-speed acceleration. They removed the rear seats to make a track variant. They drag raced the Cayenne EV against the 918
* Rolls Royce's first line about the Spectre was a quote from Charles Rolls in 1900 wishing for EVs and how the Spectre finally grants that wish
* BMW gave their upcoming EVs the same name as the company-rescuing gamble from the 1960s and styling cues to match
* Jaguar are desperately trying to convince people that their new EV is a modern XJC
* Mercedes gave the AMG GT EV the exact same sound as their V8
* Audi say the Concept C is inspired by their cars going back to 1936
* Alpine say the A110 EV is still focused on being as light as possible (for an EV)

Everyone is focusing on legacy and brand identity. But Ferrari...""look at our interior designed by the iPhone guy."" They haven't even confirmed the body style. IMO it's very strange messaging from the quintessential supercar maker.

**TL;DR**: new Ferrari Luce interior video [HERE](https://youtu.be/DP7vVve0jGc?si=hdGMrsiZH2v86YlF). Why no focus on how it drives?",61,0.7699999809265137,74,2026-04-16 16:41:07+00:00,/r/cars/comments/1sn8xtm/ferrari_luce_interior/,False,video,reddit
1r0l4ck,cars,Ferrari Luce,MotorSpexx,Ferrari Luce | Interior Review: Inside Maranello’s First Electric Car by iPhone designer Jony Ive,,Ferrari Luce | Interior Review: Inside Maranello’s First Electric Car by iPhone designer Jony Ive.,1,1.0,1,2026-02-10 00:01:33+00:00,/r/cars/comments/1r0l4ck/ferrari_luce_interior_review_inside_maranellos/,False,,reddit
1r07evb,cars,Ferrari Luce,dsarif70,Ferrari Luce EV video shows paddle-shifting,"Scroll a bit down and at 0:40s it shows upshifting.

Now we know why they had the Hyundai for benchmarking. :) ","Ferrari Luce EV video shows paddle-shifting. Scroll a bit down and at 0:40s it shows upshifting.

Now we know why they had the Hyundai for benchmarking. :)",32,0.7799999713897705,29,2026-02-09 15:38:00+00:00,/r/cars/comments/1r07evb/ferrari_luce_ev_video_shows_paddleshifting/,False,,reddit
1r04v4e,cars,Ferrari Luce,jlgolson,Jony Ive designed the iPhone. Then every carmaker copied the screen. The Ferrari Luce is his argument that they got it wrong.,"I spent a day with Ive, Marc Newson, and the Ferrari Luce interior. Ive's point is simple: the iPhone has a screen because it needs to be everything. A car doesn't need to be everything. It needs to drive. So the Luce has physical controls — dedicated aluminum toggles, glass switches, a mechanical manettino — instead of one big touchscreen running everything. His argument is the entire industry looked at the iPhone and learned the wrong lesson. They copied the shape. They should have copied the thinking. Full writeup and video.","Jony Ive designed the iPhone. Then every carmaker copied the screen. The Ferrari Luce is his argument that they got it wrong.. I spent a day with Ive, Marc Newson, and the Ferrari Luce interior. Ive's point is simple: the iPhone has a screen because it needs to be everything. A car doesn't need to be everything. It needs to drive. So the Luce has physical controls — dedicated aluminum toggles, glass switches, a mechanical manettino — instead of one big touchscreen running everything. His argument is the entire industry looked at the iPhone and learned the wrong lesson. They copied the shape. They should have copied the thinking. Full writeup and video.",0,0.4099999964237213,7,2026-02-09 13:57:20+00:00,/r/cars/comments/1r04v4e/jony_ive_designed_the_iphone_then_every_carmaker/,False,,reddit
1r04f0x,cars,Ferrari Luce,Heckmotorist,"Official: Ferrari's first EV is called 'Luce', with an interior by Apple's old design boss Jony Ive",,"Official: Ferrari's first EV is called 'Luce', with an interior by Apple's old design boss Jony Ive.",811,0.949999988079071,411,2026-02-09 13:37:59+00:00,/r/cars/comments/1r04f0x/official_ferraris_first_ev_is_called_luce_with_an/,False,,reddit
1r04dd2,cars,Ferrari Luce,Heckmotorist,"Ferrari's First EV Is Named 'Luce,' and Its Interior Should Be the Future of Automotive Design",,"Ferrari's First EV Is Named 'Luce,' and Its Interior Should Be the Future of Automotive Design.",2,0.75,1,2026-02-09 13:35:45+00:00,/r/cars/comments/1r04dd2/ferraris_first_ev_is_named_luce_and_its_interior/,False,,reddit
1o2dzoy,cars,Ferrari Elettrica,Michael_Dinich,"Ferrari Pulled the Wraps off Its First Pure-EV Chassis, the Elettrica",,"Ferrari Pulled the Wraps off Its First Pure-EV Chassis, the Elettrica.",164,0.9100000262260437,82,2025-10-09 18:35:59+00:00,/r/cars/comments/1o2dzoy/ferrari_pulled_the_wraps_off_its_first_pureev/,False,,reddit
1tpgk07,cars,Ferrari electric,ahmadmz3,Ferrari's Electric Car Looks Like...,[removed],Ferrari's Electric Car Looks Like.... [removed],1,1.0,1,2026-05-27 19:50:27+00:00,/r/cars/comments/1tpgk07/ferraris_electric_car_looks_like/,False,Potentially Misleading,reddit
1tpf8hf,cars,Ferrari electric,ToughHopeful4760,Ferrari's first electric vehicle met with market skepticism,,Ferrari's first electric vehicle met with market skepticism.,1,1.0,1,2026-05-27 19:03:50+00:00,/r/cars/comments/1tpf8hf/ferraris_first_electric_vehicle_met_with_market/,False,,reddit
1to4tnt,cars,Ferrari electric,LongjumpingLock5875,‘The market has spoken’: Ferrari shares fall after carmaker unveils first fully electric vehicle.,,‘The market has spoken’: Ferrari shares fall after carmaker unveils first fully electric vehicle..,1587,0.949999988079071,412,2026-05-26 12:01:04+00:00,/r/cars/comments/1to4tnt/the_market_has_spoken_ferrari_shares_fall_after/,False,,reddit
