id,subreddit,matched_query,author,title,selftext,text,score,upvote_ratio,num_comments,created_at,permalink,over_18,link_flair_text,source
1twpt2u,Ferrari,Ferrari Luce,bojacker,Jony Ive Shows Me The Most Controversial Ferrari Ever (Ferrari Luce),This was an interesting interview. There are a lot of food for thought from a technology perspective. It makes me think more that this is a direction all cars in general are going to head soon.,Jony Ive Shows Me The Most Controversial Ferrari Ever (Ferrari Luce). This was an interesting interview. There are a lot of food for thought from a technology perspective. It makes me think more that this is a direction all cars in general are going to head soon.,1,1.0,1,2026-06-04 14:46:22+00:00,/r/Ferrari/comments/1twpt2u/jony_ive_shows_me_the_most_controversial_ferrari/,False,Video,reddit
1twhqg7,Ferrari,Ferrari Luce,ProxyLumina,Ferrari Luce track shots,,Ferrari Luce track shots.,1,1.0,1,2026-06-04 08:42:22+00:00,/r/Ferrari/comments/1twhqg7/ferrari_luce_track_shots/,False,Photo,reddit
1tw9mvl,Ferrari,Ferrari Luce,glorija24635,Who thought it was good idea to relies Ferrari Luce as a 4 door EV???,,Who thought it was good idea to relies Ferrari Luce as a 4 door EV???.,1,1.0,0,2026-06-04 01:48:35+00:00,/r/Ferrari/comments/1tw9mvl/who_thought_it_was_good_idea_to_relies_ferrari/,False,Question,reddit
1tvja69,Ferrari,Ferrari Luce,ProxyLumina,Ferrari Luce at various shots,,Ferrari Luce at various shots.,1,1.0,1,2026-06-03 08:39:21+00:00,/r/Ferrari/comments/1tvja69/ferrari_luce_at_various_shots/,False,Photo,reddit
1tv85sj,Ferrari,Ferrari Luce,Mulga_Will,Ferrari Luce walk through,,Ferrari Luce walk through.,0,0.33000001311302185,5,2026-06-02 23:40:10+00:00,/r/Ferrari/comments/1tv85sj/ferrari_luce_walk_through/,False,Video,reddit
1tv84cc,Ferrari,Ferrari Luce,Mulga_Will,Ferrari Luce walk though,,Ferrari Luce walk though.,1,1.0,1,2026-06-02 23:38:29+00:00,/r/Ferrari/comments/1tv84cc/ferrari_luce_walk_though/,False,Video,reddit
1tuuqzy,Ferrari,Ferrari Luce,Nerd_guy6391,Better Ferrari Luce 😭✌️,,Better Ferrari Luce 😭✌️.,1,1.0,1,2026-06-02 15:41:36+00:00,/r/Ferrari/comments/1tuuqzy/better_ferrari_luce/,False,Photo,reddit
1tupw0x,Ferrari,Ferrari Luce,LotusFan1,Ferrari Luce by Venuum: che ne pensate?,[removed],Ferrari Luce by Venuum: che ne pensate?. [removed],1,1.0,0,2026-06-02 12:45:45+00:00,/r/Ferrari/comments/1tupw0x/ferrari_luce_by_venuum_che_ne_pensate/,False,News,reddit
1tupu65,Ferrari,Ferrari Luce,LotusFan1,Ferrari Luce by Venuum: che ne pensate?,[removed],Ferrari Luce by Venuum: che ne pensate?. [removed],1,1.0,0,2026-06-02 12:43:39+00:00,/r/Ferrari/comments/1tupu65/ferrari_luce_by_venuum_che_ne_pensate/,False,News,reddit
1tunlve,Ferrari,Ferrari Luce,bojacker,Can we please stop with the AI design posts?,"I’m tired of people just posting AI generated cars and saying they did a better job than all those car designers who get paid to do it. I understand majority of us don’t like the Luce direction. But making low effort AI renders and masquerading as if you just solved Ferrari design is revolting. If you genuinely want to suggest a new design, put in the effort and actually figure out what’s wrong and correct it. Show us an actual car design correcting the issues and making it better than it is. I loved seeing some other designers who addressed the issues about its shape and proportions, now that’s a great way to show what could be better. 

Most of the renders here are just another Ferrari mishmashed with other brands with no originality to show in it. Automotive designers are usually given a really tight brief about what the business wants them to design and they go through hundreds of concepts and design directions. I’ll say this again, those designers know better than most of us here and knew what they were doing. 

You’re angry because you expected a certain look and this is not. It’s also our expectations that’s hurting us. I’m certain Ferrari wanted a departure from what they’re generally popular for and attract newer audiences with this design. 

I’m certain there are Ferrari folks on this sub, let’s show them our passion through more useful discussions on what’s good and what bad rather than posting AI content. 

(I genuinely raised my eyebrows when I saw Luce first, but over days I started to appreciate it because it’s not trying to be a 2-door Ferrari. It’s a 5-seater daily driver. I don’t know who’s driving a $650k daily driver, but that’s the market Ferrari is going for. Also, the interiors are the most beautifully thought out ones ever imo) 

Apologies for the rant. Thank you for your patience. ","Can we please stop with the AI design posts?. I’m tired of people just posting AI generated cars and saying they did a better job than all those car designers who get paid to do it. I understand majority of us don’t like the Luce direction. But making low effort AI renders and masquerading as if you just solved Ferrari design is revolting. If you genuinely want to suggest a new design, put in the effort and actually figure out what’s wrong and correct it. Show us an actual car design correcting the issues and making it better than it is. I loved seeing some other designers who addressed the issues about its shape and proportions, now that’s a great way to show what could be better. 

Most of the renders here are just another Ferrari mishmashed with other brands with no originality to show in it. Automotive designers are usually given a really tight brief about what the business wants them to design and they go through hundreds of concepts and design directions. I’ll say this again, those designers know better than most of us here and knew what they were doing. 

You’re angry because you expected a certain look and this is not. It’s also our expectations that’s hurting us. I’m certain Ferrari wanted a departure from what they’re generally popular for and attract newer audiences with this design. 

I’m certain there are Ferrari folks on this sub, let’s show them our passion through more useful discussions on what’s good and what bad rather than posting AI content. 

(I genuinely raised my eyebrows when I saw Luce first, but over days I started to appreciate it because it’s not trying to be a 2-door Ferrari. It’s a 5-seater daily driver. I don’t know who’s driving a $650k daily driver, but that’s the market Ferrari is going for. Also, the interiors are the most beautifully thought out ones ever imo) 

Apologies for the rant. Thank you for your patience.",126,0.8199999928474426,37,2026-06-02 11:05:07+00:00,/r/Ferrari/comments/1tunlve/can_we_please_stop_with_the_ai_design_posts/,False,Art,reddit
1tui6uy,Ferrari,Ferrari Luce,Optimal-Common-5396,Ferrari KC23 VS Ferrari Luce. Was the one-off a sign of things to come?,"Obviously the KC23 looks so much better but I'm thinking maybe the KC23 was inspiration for the Luce's design, or were they already thinking of going in that direction?","Ferrari KC23 VS Ferrari Luce. Was the one-off a sign of things to come?. Obviously the KC23 looks so much better but I'm thinking maybe the KC23 was inspiration for the Luce's design, or were they already thinking of going in that direction?",0,0.3499999940395355,6,2026-06-02 06:08:18+00:00,/r/Ferrari/comments/1tui6uy/ferrari_kc23_vs_ferrari_luce_was_the_oneoff_a/,False,Question,reddit
1ttsw3j,Ferrari,Ferrari Luce,excilser,Ferrari Luce Spotted (Bad Photo),[removed],Ferrari Luce Spotted (Bad Photo). [removed],1,1.0,0,2026-06-01 13:51:56+00:00,/r/Ferrari/comments/1ttsw3j/ferrari_luce_spotted_bad_photo/,False,Photo,reddit
1ttmhkw,Ferrari,Ferrari Luce,Great-Technician-415,Ferrari Luce - Modern 308 GT4?,"I know the 308 GT4 is generally looked at now fondly, however when it first came out in the 70’s there were many parallels to what we’re seeing with the Luce today. 

Firstly the design, people HATED the wedge-shaped design because how radically different it was compared to what came before it. This was the first time Ferrari worked with Bertone to design a production car, and due to this reaction it was the last. Similarly with the Luce people hate the design because of its sharp deviation from previous and current Ferrari models, and this is also Ferraris first time working with LoveFrom, and I suspect it will be the last.

Secondly the 308 GT4 was a series of firsts for Ferrari, it was the first mid-engined V8 with a 2+2 seating arrangement. Comparatively the Luce is the first electric powered car with a 5 seat seating arrangement. Both cars were received negatively due to their clear deviations of what we expect from Ferrari.

Subsequently the 308 GT4 sold poorly, and even when they switched over to use Ferrari badging as opposed to Dino badges on the cars, due to pressure from dealers in an attempt to increase sales. I suspect the Luce will share the same fate given its price-tag and the reaction from people. Will the Luce be hated now but looked back upon fondly later like the GT4? I don’t see it personally but good for thought…","Ferrari Luce - Modern 308 GT4?. I know the 308 GT4 is generally looked at now fondly, however when it first came out in the 70’s there were many parallels to what we’re seeing with the Luce today. 

Firstly the design, people HATED the wedge-shaped design because how radically different it was compared to what came before it. This was the first time Ferrari worked with Bertone to design a production car, and due to this reaction it was the last. Similarly with the Luce people hate the design because of its sharp deviation from previous and current Ferrari models, and this is also Ferraris first time working with LoveFrom, and I suspect it will be the last.

Secondly the 308 GT4 was a series of firsts for Ferrari, it was the first mid-engined V8 with a 2+2 seating arrangement. Comparatively the Luce is the first electric powered car with a 5 seat seating arrangement. Both cars were received negatively due to their clear deviations of what we expect from Ferrari.

Subsequently the 308 GT4 sold poorly, and even when they switched over to use Ferrari badging as opposed to Dino badges on the cars, due to pressure from dealers in an attempt to increase sales. I suspect the Luce will share the same fate given its price-tag and the reaction from people. Will the Luce be hated now but looked back upon fondly later like the GT4? I don’t see it personally but good for thought…",164,0.7799999713897705,52,2026-06-01 09:02:10+00:00,/r/Ferrari/comments/1ttmhkw/ferrari_luce_modern_308_gt4/,False,Question,reddit
1ttfzdv,Ferrari,Ferrari Luce,WebZealousideal9739,Was the Ferrari Luce EV supposed to look like this?,Note: this was not made by ai ,Was the Ferrari Luce EV supposed to look like this?. Note: this was not made by ai,0,0.4399999976158142,27,2026-06-01 03:18:14+00:00,/r/Ferrari/comments/1ttfzdv/was_the_ferrari_luce_ev_supposed_to_look_like_this/,False,Question,reddit
1ttftqd,Ferrari,Ferrari Luce,Embarrassed-East-904,Hot take: The Ferrari Luce might be the most important Ferrari of the last 20 years.,"Everyone is clowning on it because it's electric, has 4 doors, and doesn't look like a traditional Ferrari. But that's exactly why it's important.

Ferrari could've played it safe and built another V8 supercar. Instead, they made a 1,000+ hp EV that completely breaks from their design language and targets an entirely new type of buyer.

People hated the Purosangue when it was announced too. Now they're everywhere.

In 20 years, I think the Luce will either be remembered as Ferrari's biggest mistake or one of the most significant cars in the company's history.","Hot take: The Ferrari Luce might be the most important Ferrari of the last 20 years.. Everyone is clowning on it because it's electric, has 4 doors, and doesn't look like a traditional Ferrari. But that's exactly why it's important.

Ferrari could've played it safe and built another V8 supercar. Instead, they made a 1,000+ hp EV that completely breaks from their design language and targets an entirely new type of buyer.

People hated the Purosangue when it was announced too. Now they're everywhere.

In 20 years, I think the Luce will either be remembered as Ferrari's biggest mistake or one of the most significant cars in the company's history.",0,0.30000001192092896,17,2026-06-01 03:10:49+00:00,/r/Ferrari/comments/1ttftqd/hot_take_the_ferrari_luce_might_be_the_most/,False,Article,reddit
1tt3iuw,Ferrari,Ferrari Luce,Blitzen_Bugatti,"Now that the Ferrari Lose has been revealed, what do you guys think of the F80 now?","A lot of people hated the F80 when it was revealed. But now that the Ferrari Luce is revealed, surely some opinions have changed?","Now that the Ferrari Lose has been revealed, what do you guys think of the F80 now?. A lot of people hated the F80 when it was revealed. But now that the Ferrari Luce is revealed, surely some opinions have changed?",532,0.9300000071525574,142,2026-05-31 18:38:29+00:00,/r/Ferrari/comments/1tt3iuw/now_that_the_ferrari_lose_has_been_revealed_what/,False,Question,reddit
1tt2dgu,Ferrari,Ferrari Luce,Entire_Number7785,Someone made a Rendering for a ‘Mansory’ Ferrari Luce. I think this is way better than stock.  /S,"https://preview.redd.it/cn3klu3zhi4h1.jpg?width=3312&format=pjpg&auto=webp&s=c604c076b15ab0a8fde1eb6e9abe24cb82bfbb3c

INSANE /S/S/S/S/S","Someone made a Rendering for a ‘Mansory’ Ferrari Luce. I think this is way better than stock.  /S. https://preview.redd.it/cn3klu3zhi4h1.jpg?width=3312&format=pjpg&auto=webp&s=c604c076b15ab0a8fde1eb6e9abe24cb82bfbb3c

INSANE /S/S/S/S/S",0,0.25,3,2026-05-31 17:57:32+00:00,/r/Ferrari/comments/1tt2dgu/someone_made_a_rendering_for_a_mansory_ferrari/,False,Photo,reddit
1tt1zko,Ferrari,Ferrari Luce,kkhouete,Someone made a Rendering for a ‘Mansory’ Ferrari Luce. I think this is way better than stock.,,Someone made a Rendering for a ‘Mansory’ Ferrari Luce. I think this is way better than stock..,0,0.2800000011920929,9,2026-05-31 17:42:49+00:00,/r/Ferrari/comments/1tt1zko/someone_made_a_rendering_for_a_mansory_ferrari/,False,Photo,reddit
